### ISSUE TITLE
Help making it work with colima

### ISSUE THREAD

**Issue by TiagoJacobs** [chipmk/docker-mac-net-connect#16]
Hello!

I am using [colima](https://github.com/abiosoft/colima), to run x64 dockers in M1 (this is required for some components of our project).

For an example only, I've performed these commands on my M1:

```
brew install docker
brew install colima
colima start --arch x86_64 --cpu 4 --memory 6 --disk 20 --network-address --layer=true
```

After this is done, I can create docker containers using the regular docker commands.

To login within the colima machine, we can use:
```
colima ssh
```

I've checked and colima kernel have the wireguard support:
```
root@colima:~# ip link add dev wg0 type wireguard
root@colima:~# ip addr | grep wg0
16: wg0: <POINTOPOINT,NOARP> mtu 1420 qdisc noop state DOWN group default qlen 1000
```

From this point, what would be the best way to plug your tool with this environment?

**Comment by gregnr** [comment]
Hey @TiagoJacobs! Sorry for the delay. Out of curiosity, any chance `docker-mac-net-connect` just worked as is with the above setup? Assuming you were able to run regular `docker` commands, usually that would mean you're connecting over the standard `/var/run/docker.sock` unix socket which `docker-mac-net-connect` also uses. Otherwise if colima sets this up somewhere else, we will just need `docker-mac-net-connect` to connect via that endpoint instead.

Beyond that, I can't think of any reason `docker-mac-net-connect` wouldn't just work as-is. In fact, this has been successfully tested with Rancher Desktop which exposes Docker via the standard `/var/run/docker.sock` socket (when Docker is enabled).

Let me know!

**Comment by night0wl** [comment]
I have been trying to get this to work with both Colima and Rancher in order to replace Docker for Desktop. I cannot get it to work with either. For Colima I had to manually symlink `/var/run/docker.sock` to be able to run Docker commands, Rancher does this automatically.

In both cases when I run `docker-mac-net-connector` I see the following in the log
```
DEBUG: (utun3) 2023/04/21 10:50:07 Interface utun3 created
DEBUG: (utun3) 2023/04/21 10:50:07 Wireguard server listening
DEBUG: (utun3) 2023/04/21 10:50:07 Setting up Wireguard on Docker Desktop VM
Creating WireGuard interface chip0
Assigning IP to WireGuard interface
Configuring WireGuard device
Adding iptables NAT rule for host WireGuard IP
Setup container complete
Adding route for 172.17.0.0/16 -> utun3 (bridge)
DEBUG: (utun3) 2023/04/21 10:50:09 Watching Docker events
```

This suggests that all is well and that it has created both ends of the tunnel. However, if I run an nginx container (as per the example), I cannot `curl -I 172.17.0.2` from the host.

I previously had this working with Docker for Desktop. Any suggestions of what else might be causing an issue?

**Comment by gregnr** [comment]
Hi @night0wl, thanks for the report. I will try to replicate this setup on Colima when I get a minute.

In the mean time can you confirm:
- You do not have another interface bound to 172.17.0.0/16?
- You can run `netstat -r` to help debug this - please share the results if you are willing
- What is the result of `docker network inspect bridge` (after starting your test container, eg. `nginx`)?
- What is the result of `ifconfig utun3` (replace `utun3` with the virtual interface shown in the logs)

**Comment by night0wl** [comment]
Thanks for the reply @gregnr, I appreciate the help. See below:

The only interface binding for 172.17 is to utun3

Result of `docker network inspect bridge` with `nginx` container running
```
[
    {
        "Name": "bridge",
        "Id": "eb8ffd3b267e0627f4305d43b6ed48d1da33d334676d290c9c2f5f544ffe0600",
        "Created": "2023-04-21T10:08:56.055517587Z",
        "Scope": "local",
        "Driver": "bridge",
        "EnableIPv6": false,
        "IPAM": {
            "Driver": "default",
            "Options": null,
            "Config": [
                {
                    "Subnet": "172.17.0.0/16"
                }
            ]
        },
        "Internal": false,
        "Attachable": false,
        "Ingress": false,
        "ConfigFrom": {
            "Network": ""
        },
        "ConfigOnly": false,
        "Containers": {
            "0b423b8e5f58578570270136b4a72e47c64c47d7fc8101b3dac78dfb5dd90eac": {
                "Name": "nginx",
                "EndpointID": "27b08684228460837883a545a839cef6bf2cb437b7e9d3c3c1bb1e4559a5da3e",
                "MacAddress": "02:42:ac:11:00:02",
                "IPv4Address": "172.17.0.2/16",
                "IPv6Address": ""
            }
        },
        "Options": {
            "com.docker.network.bridge.default_bridge": "true",
            "com.docker.network.bridge.enable_icc": "true",
            "com.docker.network.bridge.enable_ip_masquerade": "true",
            "com.docker.network.bridge.host_binding_ipv4": "0.0.0.0",
            "com.docker.network.bridge.name": "docker0",
            "com.docker.network.driver.mtu": "1500"
        },
        "Labels": {}
    }
]
```

Result of `ifconfig utun3`
```
utun3: flags=8051<UP,POINTOPOINT,RUNNING,MULTICAST> mtu 1420
	inet 10.33.33.1 --> 10.33.33.2 netmask 0xffffffff
```

**Comment by gregnr** [comment]
Thanks for sharing. Everything looks normal 🤔 

A few more things to try (from the VM side):
- **Test if `host.docker.internal` resolves from the VM:**
    ```shell
    docker run --rm --net host wbitt/network-multitool nslookup host.docker.internal
    ```
- **Test if `host.docker.internal` is reachable from the VM:**
    ```shell
    docker run --rm --net host wbitt/network-multitool ping -c 4 host.docker.internal
    ```
- **Test if `10.33.33.1` Wireguard peer is reachable from the VM:**
    ```shell
    docker run --rm --net host wbitt/network-multitool ping -c 4 10.33.33.1
    ```
- **Test if test `nginx` container at `172.17.0.2` is reachable from the VM:**
    ```shell
    docker run --rm --net host wbitt/network-multitool curl -I 172.17.0.2
    ```
- **Check if `chip0` interface is set up correctly on VM:**
    ```shell
    docker run --rm --net host wbitt/network-multitool ip address show chip0
    ```
- **Check if `docker0` bridge network interface is set up correctly on VM:**
    ```shell
    docker run --rm --net host wbitt/network-multitool ip address show docker0
    ```
- **Check if `eth0` network interface to the host is set up correctly on VM:**
    ```shell
    docker run --rm --net host wbitt/network-multitool ip address show eth0
    ```

**Comment by night0wl** [comment]
I have run the above tests using Colima with `colima start --network-address`, see below:

* Test if `host.docker.internal` resolves from the VM :white_check_mark:
* Test if `host.docker.internal` is reachable from the VM :white_check_mark:
* Test if `10.33.33.1` Wireguard peer is reachable from the VM :white_check_mark:
* Test if test `nginx` container at `172.17.0.2` is reachable from the VM :white_check_mark:


* Check if chip0 interface is set up correctly on VM :x:
I suspect this is the issue here, as state is `UNKNOWN`
```
12: chip0: <POINTOPOINT,NOARP,UP,LOWER_UP> mtu 1420 qdisc noqueue state UNKNOWN group default qlen 1000
    link/none
    inet 10.33.33.2 peer 10.33.33.1/32 scope global chip0
       valid_lft forever preferred_lft forever
```

I think the other network devices are fine, but not 100%, including the output for them too
* Check if `docker0` bridge network interface is set up correctly on VM
```
5: docker0: <BROADCAST,MULTICAST,UP,LOWER_UP> mtu 1500 qdisc noqueue state UP group default
    link/ether 02:42:8c:93:af:99 brd ff:ff:ff:ff:ff:ff
    inet 172.17.0.1/16 brd 172.17.255.255 scope global docker0
       valid_lft forever preferred_lft forever
    inet6 fe80::42:8cff:fe93:af99/64 scope link
       valid_lft forever preferred_lft forever
```
* Check if `eth0` network interface to the host is set up correctly on VM
```
2: eth0: <BROADCAST,MULTICAST,UP,LOWER_UP> mtu 1500 qdisc pfifo_fast state UP group default qlen 1000
    link/ether 52:55:55:fe:12:1f brd ff:ff:ff:ff:ff:ff
    inet 192.168.5.15/24 scope global eth0
       valid_lft forever preferred_lft forever
    inet6 fec0::5055:55ff:fefe:121f/64 scope site deprecated dynamic mngtmpaddr
       valid_lft 68741sec preferred_lft 0sec
    inet6 fe80::5055:55ff:fefe:121f/64 scope link
       valid_lft forever preferred_lft forever
```

**Comment by night0wl** [comment]
I figured this out!
With a little bit of inspiration from this blog post
https://baptistout.net/posts/kubernetes-clusters-on-macos-with-loadbalancer-without-docker-desktop/

Colima does a lot of the initial setup described, including it seems some of what `socket_vmnet` was being used to do (quite possibly using it under the hood), creating a `bridge100` interface.

So what I had to do was set up the route for `172.17` on the Mac host
```
export SRC_IP=$(ifconfig bridge100 | grep "inet " | cut -d' ' -f2)
sudo route -nv add -net 172.17 $SRC_IP
```
and then SSH into the VM an setup an iptables rule
```
colima ssh
sudo iptables -t filter -A FORWARD -4 -p tcp -s <SRC_IP from host> -d 172.17.0.0/16 -j ACCEPT -i col0 -o docker0
```

This is essentially what `docker-mac-net-connect` was doing, but without the bridge. I assume that the existence of these interfaces and routes was getting in the way. For now, I can use this manual solution, but it would be awesome for `docker-mac-net-connect` to support this somehow

**Comment by gregnr** [comment]
Nice one @night0wl! Looks like `colima` uses `lima` under the hood for Linux VM management (I should have gathered that from the name 😄 ), just like Rancher Desktop. When I had experimented with Rancher Desktop I noticed there were extra bridges created that Docker Desktop didn't have. Very brief discussion here:
https://github.com/chipmk/docker-mac-net-connect/issues/8#issuecomment-1054777263

When I get some time I'll dig into this further to see if there's a way we can automate your above logic in `lima` environments.

**Comment by krysklyk** [comment]
Every year I try to set up something like this at least once and fail, feeling completely stupid. So here I am again. 

The most relevant change I could figure out since 2023 is the network isolation [introduced in Docker 28](https://www.docker.com/blog/docker-engine-28-hardening-container-networking-by-default/).

For reference, here's the iptables rules after starting Colima:

```
Chain INPUT (policy ACCEPT)
target     prot opt source               destination         

Chain FORWARD (policy DROP)
target     prot opt source               destination         
DOCKER-USER  all  --  anywhere             anywhere            
DOCKER-FORWARD  all  --  anywhere             anywhere            

Chain OUTPUT (policy ACCEPT)
target     prot opt source               destination         

Chain DOCKER (1 references)
target     prot opt source               destination         
DROP       all  --  anywhere             anywhere            

Chain DOCKER-BRIDGE (1 references)
target     prot opt source               destination         
DOCKER     all  --  anywhere             anywhere            

Chain DOCKER-CT (1 references)
target     prot opt source               destination         
ACCEPT     all  --  anywhere             anywhere             ctstate RELATED,ESTABLISHED

Chain DOCKER-FORWARD (1 references)
target     prot opt source               destination         
DOCKER-CT  all  --  anywhere             anywhere            
DOCKER-ISOLATION-STAGE-1  all  --  anywhere             anywhere            
DOCKER-BRIDGE  all  --  anywhere             anywhere            
ACCEPT     all  --  anywhere             anywhere            

Chain DOCKER-ISOLATION-STAGE-1 (1 references)
target     prot opt source               destination         
DOCKER-ISOLATION-STAGE-2  all  --  anywhere             anywhere            

Chain DOCKER-ISOLATION-STAGE-2 (1 references)
target     prot opt source               destination         
DROP       all  --  anywhere             anywhere            

Chain DOCKER-USER (1 references)
target     prot opt source               destination         
```

Let's make sure I get the flow for my to-be-forwarded package with no changes to the rules:

```
FORWARD -> DOCKER-USER -> DOCKER-FORWARD -> DOCKER-CT -> DOCKER-ISOLATION-STAGE-1 -> DOCKER-BRIDGE -> DOCKER-ISOLATION-STAGE-2 -> DROP
```

Therefore, appending to the FORWARD chain would not allow my package through anymore, correct? 

But... I tried both prepending to FORWARD, and adding it to DOCKER-USER to no avail. Also much more open rules don't seem to work. I guess the problem is with return traffic.

tcpdump on col0:

```
09:19:02.016025 ARP, Reply 192.168.64.19 is-at 52:55:55:46:1c:9e (oui Unknown), length 28
09:19:03.017711 IP 192.168.64.1.53708 > 172.17.0.2.http: Flags [S], seq 428682596, win 65535, options [mss 1460,nop,wscale 6,nop,nop,TS val 3592271919 ecr 0,sackOK,eol], length 0
09:19:04.018934 IP 192.168.64.1.53708 > 172.17.0.2.http: Flags [S], seq 428682596, win 65535, options [mss 1460,nop,wscale 6,nop,nop,TS val 3592272920 ecr 0,sackOK,eol], length 0
09:19:05.019616 IP 192.168.64.1.53708 > 172.17.0.2.http: Flags [S], seq 428682596, win 65535, options [mss 1460,nop,wscale 6,nop,nop,TS val 3592273921 ecr 0,sackOK,eol], length 0
09:19:06.021051 IP 192.168.64.1.53708 > 172.17.0.2.http: Flags [S], seq 428682596, win 65535, options [mss 1460,nop,wscale 6,nop,nop,TS val 3592274922 ecr 0,sackOK,eol], length 0
```

To my understanding, if I allow the incoming packet, the returns should be accepted like this?

```
FORWARD -> DOCKER-USER -> DOCKER-FORWARD -> DOCKER-CT -> ACCEPT 
```

In general I'm quite confused why this simple solution doesn't work, and how docker-net-mac-connect would help by doing exactly the same thing, but with a wireguard tunnel added on top of the complexity pile? (alas, I also couldn't get it to work any better - exact same behaviour).

**Comment by krysklyk** [comment]
FWIW, I also refactored some of the debug/setup scripts from the many write-ups on this to make them dynamic on other docker networks and replace awk for jq, hoping this helps someone:

```
set -euo pipefail

colima_profile="shared"
colima_host_if="bridge100"
docker_network="bridge"

interface_by_ip() {
  jq -r --arg ip "$1" '.[] | select(.addr_info[].local==$ip) | .ifname'
}
interface_by_iptables() {
  jq -r --arg ip "$1" '.[] | select(.addr_info[].local==$ip) | .ifname'
}

# On the mac side, bridge interface to colima
colima_host_ip=$(ifconfig "$colima_host_if" | grep "inet " | cut -d' ' -f2)
colima_vm_ip=$(colima list --json -p "$colima_profile" | jq -r '.address')
colima_ip_config=$(colima ssh -p $colima_profile -- ip --json a)
# On the colima side, bridge interface to mac
colima_vm_if=$(echo "$colima_ip_config" | interface_by_ip "$colima_vm_ip")
docker_subnet=$(docker network inspect $docker_network | jq -r '.[].IPAM.Config[0].Subnet')
docker_gateway=$(docker network inspect $docker_network | jq -r '.[].IPAM.Config[0].Gateway')
docker_if=$(echo $colima_ip_config | interface_by_ip "$docker_gateway")

cat <<EOF | column -t -s '|'
Name|Value
colima_host|$colima_host_ip@$colima_host_if
colima_vm|$colima_vm_ip@$colima_vm_if
docker_subnet|$docker_subnet@$docker_if
EOF

sudo route add -net $docker_subnet $colima_vm_ip 
colima ssh -p $colima_profile -- sudo iptables -t filter -A FORWARD -4 -p tcp -s $colima_host_ip -d $docker_subnet -j ACCEPT -i $colima_vm_if -o $docker_if

echo "TCPDump: "
echo colima ssh -p $colima_profile -- sudo tcpdump -i $colima_vm_if
echo colima ssh -p $colima_profile -- sudo tcpdump -i $docker_if
```

**Comment by gregnr** [comment]
Good news everyone! Colima is now officially supported as of [v0.1.7](https://github.com/chipmk/docker-mac-net-connect/releases/tag/v0.1.7). No need to manually symlink your `/var/run/docker.sock` - the server will now properly check your docker contexts and use your active context (which colima sets when it starts). All iptables rules are accounted for, even with the latest "Direct Access Filtering" rules added in Docker 28.0+ (which you might have been hitting @kalexmills). For more info please see #80.

You can upgrade to the latest by running:

```shell
brew upgrade chipmk/tap/docker-mac-net-connect
sudo brew services restart chipmk/tap/docker-mac-net-connect
```

If you encounter any issues, please let me know!
